[
  {
    "event_id": "tjjczx-0001",
    "event_type": "PERSON_RECORDED",
    "aggregate_type": "person",
    "aggregate_id": "person-yanfu",
    "occurred_at": "2024-09-01T09:00:00+08:00",
    "version": 1,
    "summary": "登记人物：严复（生卒 1854—1921）",
    "payload": {
      "person": {
        "id": "person-yanfu",
        "name": "严复",
        "born": "1854-01-08",
        "died": "1921-10-27",
        "public_note": "近代启蒙思想家、翻译家、教育家，福州侯官人，长期在天津任职办学。"
      }
    }
  },
  {
    "event_id": "tjjczx-0002",
    "event_type": "PLACE_RECORDED",
    "aggregate_type": "place",
    "aggregate_id": "place-tj-academy",
    "occurred_at": "2024-09-01T09:10:00+08:00",
    "version": 1,
    "summary": "登记地点：天津·北洋水师学堂（东局子）",
    "payload": {
      "place": {
        "id": "place-tj-academy",
        "name": "天津·北洋水师学堂（东局子）",
        "existed_from": "1880",
        "public_note": "1880 年李鸿章奏设，次年开学。"
      }
    }
  },
  {
    "event_id": "tjjczx-0003",
    "event_type": "PLACE_RECORDED",
    "aggregate_type": "place",
    "aggregate_id": "place-fz-academy",
    "occurred_at": "2024-09-01T09:10:00+08:00",
    "version": 1,
    "summary": "登记地点：福州·马尾船政学堂",
    "payload": {
      "place": {
        "id": "place-fz-academy",
        "name": "福州·马尾船政学堂",
        "existed_from": "1866",
        "public_note": "严复早年求学与归国后短暂任教之处。"
      }
    }
  },
  {
    "event_id": "tjjczx-0004",
    "event_type": "PLACE_RECORDED",
    "aggregate_type": "place",
    "aggregate_id": "place-greenwich",
    "occurred_at": "2024-09-01T09:10:00+08:00",
    "version": 1,
    "summary": "登记地点：英国·格林威治皇家海军学院",
    "payload": {
      "place": {
        "id": "place-greenwich",
        "name": "英国·格林威治皇家海军学院",
        "existed_from": "1873"
      }
    }
  },
  {
    "event_id": "tjjczx-0005",
    "event_type": "SOURCE_REGISTERED",
    "aggregate_type": "source_record",
    "aggregate_id": "src-old-chronology",
    "occurred_at": "2024-09-02T10:00:00+08:00",
    "version": 1,
    "summary": "登记来源：src-old-chronology",
    "payload": {
      "source": {
        "id": "src-old-chronology",
        "kind": "secondary_scholarship",
        "access_class": "public",
        "citation": "《天津近代名人展陈年表（2009 内部修订本）》第 47 页【样例占位】",
        "public_excerpt_note": null
      }
    }
  },
  {
    "event_id": "tjjczx-0006",
    "event_type": "CLAIM_DRAFTED",
    "aggregate_type": "historical_claim",
    "aggregate_id": "claim-arrival",
    "occurred_at": "2024-09-03T10:00:00+08:00",
    "version": 1,
    "summary": "起草主张版本：1879 年到津说（旧通行说）",
    "payload": {
      "claim_id": "claim-arrival",
      "claim_version_id": "cv-arrival-1879",
      "subject_person_id": "person-yanfu",
      "topic": "严复首次抵达天津的时间",
      "fact_class": "established_fact",
      "statement": "严复于 1879 年到天津，参与北洋水师学堂筹建。",
      "temporal": {
        "start": "1879",
        "start_certainty": "circa"
      },
      "place_id": "place-tj-academy"
    }
  },
  {
    "event_id": "tjjczx-0007",
    "event_type": "EVIDENCE_CITED",
    "aggregate_type": "historical_claim",
    "aggregate_id": "claim-arrival",
    "occurred_at": "2024-09-03T10:20:00+08:00",
    "version": 2,
    "summary": "旧年表作为 1879 说的证据登记（原证据保留）",
    "payload": {
      "claim_version_id": "cv-arrival-1879",
      "source_id": "src-old-chronology",
      "support": "indirect",
      "excerpt": "光绪五年，严氏北赴天津，襄办水师学堂。【按：此年表后经档案核对修正】",
      "note": "二手年表，未注原始出处。"
    }
  },
  {
    "event_id": "tjjczx-0008",
    "event_type": "CLAIM_REVIEWED",
    "aggregate_type": "historical_claim",
    "aggregate_id": "claim-arrival",
    "occurred_at": "2024-09-05T14:00:00+08:00",
    "version": 3,
    "summary": "评阅：暂从旧说，限期补档",
    "payload": {
      "claim_version_id": "cv-arrival-1879",
      "reviewer": "中心编审委员会（样例占位）",
      "reviewer_role": "编审",
      "verdict": "supports",
      "rationale": "沿用既有展陈通行说，先核准上线；注明仅有二手年表支撑，待原档。"
    }
  },
  {
    "event_id": "tjjczx-0009",
    "event_type": "CLAIM_APPROVED",
    "aggregate_type": "historical_claim",
    "aggregate_id": "claim-arrival",
    "occurred_at": "2024-09-06T14:00:00+08:00",
    "version": 4,
    "summary": "首次核准：1879 年到津说",
    "payload": {
      "claim_id": "claim-arrival",
      "approved_claim_version_id": "cv-arrival-1879",
      "rationale": "2024 年秋展上线节点，从旧通行说核准，证据等级标注为间接。"
    }
  },
  {
    "event_id": "tjjczx-0010",
    "event_type": "ASSET_LINKED",
    "aggregate_type": "interpretive_asset",
    "aggregate_id": "asset-panel",
    "occurred_at": "2024-09-20T10:00:00+08:00",
    "version": 1,
    "summary": "2024 秋展板引用 1879 说",
    "payload": {
      "asset": {
        "id": "asset-panel",
        "carrier": "park_panel",
        "title": "严复公园·生平年表展板",
        "live": true
      },
      "asset_version_id": "av-panel-2024",
      "claim_version_id": "cv-arrival-1879",
      "presentation_class": "established_fact",
      "locator": "公园中区展板第 2 板",
      "qr_code": "QR-PANEL-2024"
    }
  },
  {
    "event_id": "tjjczx-0011",
    "event_type": "RELEASE_PUBLISHED",
    "aggregate_type": "release_version",
    "aggregate_id": "rel-2024-autumn",
    "occurred_at": "2024-10-01T09:00:00+08:00",
    "version": 1,
    "summary": "发布 2024 秋季版",
    "payload": {
      "release_id": "rel-2024-autumn",
      "asset_version_ids": [
        "av-panel-2024"
      ],
      "public_note": "2024 秋季版展陈。"
    }
  },
  {
    "event_id": "tjjczx-0012",
    "event_type": "SOURCE_REGISTERED",
    "aggregate_type": "source_record",
    "aggregate_id": "src-essay-tabloid",
    "occurred_at": "2025-03-01T10:00:00+08:00",
    "version": 1,
    "summary": "登记一条薄弱公开来源",
    "payload": {
      "source": {
        "id": "src-essay-tabloid",
        "kind": "published_material",
        "access_class": "public",
        "citation": "民国小报《津门杂记》新编本（样例占位）"
      }
    }
  },
  {
    "event_id": "tjjczx-0013",
    "event_type": "SOURCE_REGISTERED",
    "aggregate_type": "source_record",
    "aggregate_id": "src-modern-paper",
    "occurred_at": "2025-03-01T10:10:00+08:00",
    "version": 1,
    "summary": "登记后世研究来源",
    "payload": {
      "source": {
        "id": "src-modern-paper",
        "kind": "secondary_scholarship",
        "access_class": "public",
        "citation": "今人论文《严复与北洋水师学堂》（样例占位）"
      }
    }
  },
  {
    "event_id": "tjjczx-0014",
    "event_type": "CLAIM_DRAFTED",
    "aggregate_type": "historical_claim",
    "aggregate_id": "claim-final-essay",
    "occurred_at": "2025-03-02T10:00:00+08:00",
    "version": 1,
    "summary": "起草：1922 年撰述说（晚于卒年，门禁应拦截）",
    "payload": {
      "claim_id": "claim-final-essay",
      "claim_version_id": "cv-essay-1922",
      "subject_person_id": "person-yanfu",
      "topic": "严复在津最后撰述时间",
      "fact_class": "established_fact",
      "statement": "严复 1922 年在天津完成最后一篇政论。",
      "temporal": {
        "start": "1922"
      },
      "place_id": "place-tj-academy"
    }
  },
  {
    "event_id": "tjjczx-0015",
    "event_type": "EVIDENCE_CITED",
    "aggregate_type": "historical_claim",
    "aggregate_id": "claim-final-essay",
    "occurred_at": "2025-03-02T10:05:00+08:00",
    "version": 2,
    "summary": "补薄弱证据（有来源但跨年代矛盾仍应拦截）",
    "payload": {
      "claim_version_id": "cv-essay-1922",
      "source_id": "src-essay-tabloid",
      "support": "indirect",
      "excerpt": "坊间笔记称先生晚年尚有政论。"
    }
  },
  {
    "event_id": "tjjczx-0016",
    "event_type": "CLAIM_DRAFTED",
    "aggregate_type": "historical_claim",
    "aggregate_id": "claim-meet-li",
    "occurred_at": "2025-03-02T11:00:00+08:00",
    "version": 1,
    "summary": "起草合理推断：到津即拜会李鸿章",
    "payload": {
      "claim_id": "claim-meet-li",
      "claim_version_id": "cv-meetli-inference",
      "subject_person_id": "person-yanfu",
      "topic": "严复到津后拜会李鸿章的时间",
      "fact_class": "reasonable_inference",
      "statement": "严复到津后不久即拜会李鸿章禀陈办学事宜。",
      "temporal": {
        "start": "1879",
        "start_certainty": "circa"
      },
      "place_id": "place-tj-academy"
    }
  },
  {
    "event_id": "tjjczx-0017",
    "event_type": "EVIDENCE_CITED",
    "aggregate_type": "historical_claim",
    "aggregate_id": "claim-meet-li",
    "occurred_at": "2025-03-02T11:05:00+08:00",
    "version": 2,
    "summary": "推断的旁证",
    "payload": {
      "claim_version_id": "cv-meetli-inference",
      "source_id": "src-modern-paper",
      "support": "contextual",
      "excerpt": "论文据办学时序推测二人到津之初当有会面。"
    }
  },
  {
    "event_id": "tjjczx-0018",
    "event_type": "CLAIM_APPROVED",
    "aggregate_type": "historical_claim",
    "aggregate_id": "claim-meet-li",
    "occurred_at": "2025-03-03T09:00:00+08:00",
    "version": 3,
    "summary": "按合理推断核准（分级纪律的测试对象）",
    "payload": {
      "claim_id": "claim-meet-li",
      "approved_claim_version_id": "cv-meetli-inference",
      "rationale": "时序合理但无直证，按合理推断核准，不得当作确定事实呈现。"
    }
  },
  {
    "event_id": "tjjczx-0019",
    "event_type": "CLAIM_DRAFTED",
    "aggregate_type": "historical_claim",
    "aggregate_id": "claim-uk-study",
    "occurred_at": "2025-03-02T12:00:00+08:00",
    "version": 1,
    "summary": "起草：1879 年仍在英说（无来源，且与到津说行踪冲突）",
    "payload": {
      "claim_id": "claim-uk-study",
      "claim_version_id": "cv-uk-1879",
      "subject_person_id": "person-yanfu",
      "topic": "严复 1879 年行踪",
      "fact_class": "established_fact",
      "statement": "严复 1879 年全年仍在英国格林威治海军学院学习。",
      "temporal": {
        "start": "1879"
      },
      "place_id": "place-greenwich"
    }
  },
  {
    "event_id": "tjjczx-0020",
    "event_type": "ASSET_LINKED",
    "aggregate_type": "interpretive_asset",
    "aggregate_id": "asset-video",
    "occurred_at": "2025-03-04T10:00:00+08:00",
    "version": 1,
    "summary": "视频草案：1922 年卡（越出生卒年）",
    "payload": {
      "asset": {
        "id": "asset-video",
        "carrier": "ai_video",
        "title": "AI 视频《严复与天津》",
        "live": true
      },
      "asset_version_id": "av-video-draft",
      "claim_version_id": "cv-essay-1922",
      "presentation_class": "established_fact",
      "locator": "片尾解说卡"
    }
  },
  {